{
  "schema": 1,
  "generated": "2026-08-03",
  "name": "mv",
  "options": [
    "--backup",
    "--context",
    "--force",
    "--help",
    "--interactive",
    "--no-clobber",
    "--no-target-directory",
    "--strip-trailing-slashes",
    "--suffix",
    "--target-directory",
    "--update",
    "--verbose",
    "--version",
    "-B",
    "-C",
    "-R",
    "-S",
    "-T",
    "-Z",
    "-a",
    "-b",
    "-c",
    "-d",
    "-e",
    "-f",
    "-g",
    "-h",
    "-i",
    "-k",
    "-l",
    "-n",
    "-o",
    "-p",
    "-r",
    "-s",
    "-t",
    "-u",
    "-v",
    "-w",
    "-x"
  ]
}
