{
  "schema": 1,
  "generated": "2026-08-03",
  "name": "du",
  "options": [
    "--all",
    "--apparent-size",
    "--block-size",
    "--bytes",
    "--count-links",
    "--dereference",
    "--dereference-args",
    "--exclude",
    "--exclude-from",
    "--files0-from",
    "--help",
    "--human-readable",
    "--inodes",
    "--max-depth",
    "--no-dereference",
    "--null",
    "--one-file-system",
    "--separate-dirs",
    "--si",
    "--summarize",
    "--threshold",
    "--time",
    "--time-style",
    "--total",
    "--version",
    "-B",
    "-C",
    "-D",
    "-H",
    "-L",
    "-P",
    "-R",
    "-S",
    "-T",
    "-X",
    "-a",
    "-b",
    "-c",
    "-d",
    "-e",
    "-f",
    "-g",
    "-h",
    "-i",
    "-k",
    "-l",
    "-m",
    "-o",
    "-p",
    "-r",
    "-s",
    "-t",
    "-v",
    "-w",
    "-x"
  ]
}
