{
  "schema": 1,
  "generated": "2026-08-03",
  "name": "id",
  "options": [
    "--context",
    "--group",
    "--groups",
    "--help",
    "--name",
    "--real",
    "--user",
    "--version",
    "--zero",
    "-C",
    "-G",
    "-R",
    "-T",
    "-Z",
    "-a",
    "-b",
    "-c",
    "-d",
    "-e",
    "-f",
    "-g",
    "-h",
    "-i",
    "-k",
    "-l",
    "-n",
    "-o",
    "-p",
    "-r",
    "-s",
    "-t",
    "-u",
    "-v",
    "-w",
    "-x",
    "-z"
  ]
}
