{
  "schema": 1,
  "generated": "2026-08-03",
  "name": "whoami",
  "options": [
    "--help",
    "--version",
    "-C",
    "-R",
    "-T",
    "-a",
    "-b",
    "-c",
    "-d",
    "-e",
    "-f",
    "-g",
    "-h",
    "-i",
    "-k",
    "-l",
    "-o",
    "-p",
    "-r",
    "-s",
    "-t",
    "-u",
    "-v",
    "-w",
    "-x"
  ]
}
