{
  "schema": 1,
  "generated": "2026-08-03",
  "name": "date",
  "options": [
    "--date",
    "--debug",
    "--file",
    "--help",
    "--iso-8601",
    "--reference",
    "--resolution",
    "--rfc-3339",
    "--rfc-email",
    "--set",
    "--universal",
    "--utc",
    "--version",
    "-C",
    "-I",
    "-R",
    "-T",
    "-a",
    "-b",
    "-c",
    "-d",
    "-e",
    "-f",
    "-g",
    "-h",
    "-i",
    "-k",
    "-l",
    "-o",
    "-p",
    "-r",
    "-s",
    "-t",
    "-u",
    "-v",
    "-w",
    "-x"
  ]
}
