{
  "schema": 1,
  "generated": "2026-08-03",
  "name": "head",
  "options": [
    "--bytes",
    "--help",
    "--lines",
    "--quiet",
    "--silent",
    "--verbose",
    "--version",
    "--zero-terminated",
    "-C",
    "-R",
    "-T",
    "-a",
    "-b",
    "-c",
    "-d",
    "-e",
    "-f",
    "-g",
    "-h",
    "-i",
    "-k",
    "-l",
    "-n",
    "-o",
    "-p",
    "-q",
    "-r",
    "-s",
    "-t",
    "-v",
    "-w",
    "-x",
    "-z"
  ]
}
