{
  "schema": 1,
  "generated": "2026-08-03",
  "name": "who",
  "options": [
    "--all",
    "--boot",
    "--count",
    "--dead",
    "--heading",
    "--help",
    "--ips",
    "--login",
    "--lookup",
    "--mesg",
    "--message",
    "--process",
    "--runlevel",
    "--short",
    "--time",
    "--users",
    "--version",
    "--writable",
    "-C",
    "-H",
    "-R",
    "-T",
    "-a",
    "-b",
    "-c",
    "-d",
    "-e",
    "-f",
    "-g",
    "-h",
    "-i",
    "-k",
    "-l",
    "-m",
    "-o",
    "-p",
    "-q",
    "-r",
    "-s",
    "-t",
    "-u",
    "-v",
    "-w",
    "-x"
  ]
}
