{
  "schema": 1,
  "generated": "2026-08-03",
  "name": "chown",
  "options": [
    "--changes",
    "--dereference",
    "--from",
    "--help",
    "--no-dereference",
    "--no-preserve-root",
    "--preserve-root",
    "--quiet",
    "--recursive",
    "--reference",
    "--silent",
    "--verbose",
    "--version",
    "-B",
    "-C",
    "-H",
    "-L",
    "-P",
    "-R",
    "-T",
    "-a",
    "-b",
    "-c",
    "-d",
    "-e",
    "-f",
    "-g",
    "-h",
    "-i",
    "-k",
    "-l",
    "-o",
    "-p",
    "-r",
    "-s",
    "-t",
    "-v",
    "-w",
    "-x"
  ]
}
