{
  "schema": 1,
  "generated": "2026-08-03",
  "name": "rm",
  "options": [
    "--dir",
    "--force",
    "--help",
    "--interactive",
    "--no-preserve-root",
    "--one-file-system",
    "--preserve-root",
    "--recursive",
    "--verbose",
    "--version",
    "-B",
    "-C",
    "-I",
    "-R",
    "-T",
    "-a",
    "-b",
    "-c",
    "-d",
    "-e",
    "-f",
    "-g",
    "-h",
    "-i",
    "-k",
    "-l",
    "-o",
    "-p",
    "-r",
    "-s",
    "-t",
    "-v",
    "-w",
    "-x"
  ]
}
