{
  "schema": 1,
  "generated": "2026-08-03",
  "name": "rmdir",
  "options": [
    "--help",
    "--ignore-fail-on-non-empty",
    "--parents",
    "--verbose",
    "--version",
    "-B",
    "-C",
    "-R",
    "-T",
    "-a",
    "-b",
    "-c",
    "-d",
    "-e",
    "-f",
    "-g",
    "-h",
    "-i",
    "-k",
    "-l",
    "-o",
    "-p",
    "-r",
    "-s",
    "-t",
    "-v",
    "-w",
    "-x"
  ]
}
