{
  "schema": 1,
  "generated": "2026-08-03",
  "name": "cp",
  "options": [
    "--archive",
    "--attributes-only",
    "--backup",
    "--context",
    "--copy-contents",
    "--dereference",
    "--force",
    "--help",
    "--interactive",
    "--link",
    "--no-clobber",
    "--no-dereference",
    "--no-preserve",
    "--no-target-directory",
    "--one-file-system",
    "--parents",
    "--preserve",
    "--recursive",
    "--reflink",
    "--remove-destination",
    "--sparse",
    "--strip-trailing-slashes",
    "--suffix",
    "--symbolic-link",
    "--target-directory",
    "--update",
    "--verbose",
    "--version",
    "-B",
    "-C",
    "-H",
    "-L",
    "-P",
    "-R",
    "-S",
    "-T",
    "-Z",
    "-a",
    "-b",
    "-c",
    "-d",
    "-e",
    "-f",
    "-g",
    "-h",
    "-i",
    "-k",
    "-l",
    "-n",
    "-o",
    "-p",
    "-r",
    "-s",
    "-t",
    "-u",
    "-v",
    "-w",
    "-x"
  ]
}
