{
  "schema": 1,
  "generated": "2026-08-03",
  "name": "readlink",
  "options": [
    "--canonicalize",
    "--canonicalize-existing",
    "--canonicalize-missing",
    "--help",
    "--no-newline",
    "--quiet",
    "--silent",
    "--verbose",
    "--version",
    "--zero",
    "-C",
    "-R",
    "-T",
    "-a",
    "-b",
    "-c",
    "-d",
    "-e",
    "-f",
    "-g",
    "-h",
    "-i",
    "-k",
    "-l",
    "-m",
    "-n",
    "-o",
    "-p",
    "-q",
    "-r",
    "-s",
    "-t",
    "-v",
    "-w",
    "-x",
    "-z"
  ]
}
