{
  "schema": 1,
  "generated": "2026-08-03",
  "name": "split",
  "options": [
    "--additional-suffix",
    "--bytes",
    "--elide-empty-files",
    "--filter",
    "--help",
    "--hex-suffixes",
    "--line-bytes",
    "--lines",
    "--number",
    "--numeric-suffixes",
    "--separator",
    "--suffix-length",
    "--unbuffered",
    "--verbose",
    "--version",
    "-C",
    "-R",
    "-T",
    "-a",
    "-b",
    "-c",
    "-d",
    "-e",
    "-f",
    "-g",
    "-h",
    "-i",
    "-k",
    "-l",
    "-n",
    "-o",
    "-p",
    "-r",
    "-s",
    "-t",
    "-u",
    "-v",
    "-w",
    "-x"
  ]
}
