{
  "schema": 1,
  "generated": "2026-08-03",
  "name": "robocopy",
  "options": [
    "/A",
    "/B",
    "/E",
    "/FP",
    "/IA",
    "/IF",
    "/IM",
    "/IS",
    "/IT",
    "/J",
    "/L",
    "/LI",
    "/M",
    "/MT",
    "/NC",
    "/NP",
    "/NS",
    "/PF",
    "/R",
    "/RH",
    "/S",
    "/SJ",
    "/SL",
    "/TS",
    "/UL",
    "/V",
    "/W",
    "/X",
    "/XA",
    "/XC",
    "/XD",
    "/XF",
    "/XJ",
    "/XL",
    "/XN",
    "/XO",
    "/XX",
    "/Z",
    "/ZB"
  ]
}
